<!-- DTD para el inventario juegos de la empresa -->
<!ELEMENT inventario (Juegos+)>
<!ELEMENT Juegos (empresa, usuario, nombre_tipo)>
<!ELEMENT empresa (#PCDATA)>
<!ELEMENT usuario (#PCDATA)>
<!ELEMENT nombre_tipo (#PCDATA)>
<!ATTLIST Juegos
    id ID #REQUIRED
>